swda_filename,ptb_basename,conversation_no,transcript_index,act_tag,caller,utterance_index,subutterance_index,text,pos,trees,ptb_treenumbers
sw13utt/sw_1307_2752.utt,,2752,273,b,A,118,1,Uh-huh. /,,,
sw13utt/sw_1307_2752.utt,,2752,274,sd,B,119,1,"And it was like ice cold, spring water  /",,,
sw13utt/sw_1307_2752.utt,,2752,275,sd,B,119,2,"and I guess parts of the, the city still ha-, you know, get that,  /",,,
sw13utt/sw_1307_2752.utt,,2752,276,sv,B,119,3,"but, uh, that was, that was really wonderful. /",,,
sw13utt/sw_1307_2752.utt,,2752,277,ba,A,120,1,"Oh, I bet it was. /",,,
sw13utt/sw_1307_2752.utt,,2752,278,sv,B,121,1,"It was really, really good. /",,,
sw13utt/sw_1307_2752.utt,,2752,279,b,A,122,1,"Yeah,  /",,,
sw13utt/sw_1307_2752.utt,,2752,280,%,A,122,2,"the-, - /",,,
sw13utt/sw_1307_2752.utt,,2752,281,sv,A,122,3,"once it's been filtered an if it's a deep enough well, filtered through all the earth and everything I think that, uh, - /",,,
sw13utt/sw_1307_2752.utt,,2752,282,sv,A,122,4,it depends of course where you are.  /,,,
sw13utt/sw_1307_2752.utt,,2752,283,sv,A,122,5,"A good well, though, I think is very healthy ... /",,,
